Case Number,Case Title,Facts,Decision,Ruling,Verdict
"G.R. No. 260434, January 31, 2024","NOW TELECOM COMPANY, INC., PETITIONER, VS. NATIONAL TELECOMMUNICATIONS COMMISSION, RESPONDENT.","On January 8, 2018, the Department of Information and Communications Technology (DICT) issued Memorandum Order (M.O.) No. 001, series of 2018, entitled, ""Policy Guidelines for the Entry of a New Major Player in the Public Telecommunications Market,"" in compliance with the directive of then President Rodrigo R. Duterte (President Duterte) to fast-track the entry of a new major player (NMP) to compete in the Philippine telecommunications market.

The said memorandum order provides that the NMP applicant must (1) possess a valid congressional telecommunications franchise, and the NTC shall issue the appropriate licenses/authorities to the winner after the bid; (2) not be a subsidiary, affiliate, or have any corporate or financial interest with the Globe Group or PLDT Group of Companies; and (3) have a written and binding commitment from a foreign joint venture company, if applicable.[5] It also provides that the applicant must have the highest committed investment for the first five years, and such commitment must be secured with a performance bond.[6] The NMP shall be assigned radio frequency bands that are available for assignment.[7] The NTC was directed to promulgate the memorandum circular containing the Terms of Reference (TOR) for the selection and assignment of radio frequencies for the purpose.[8]

On April 6, 2018, former President Duterte issued Administrative Order (A.O.) No. 11, series of 2018, creating an Oversight Committee to assist the NTC in formulating the TOR, oversee its compliance, ensure timely implementation, and exercise such incidental powers as may be necessary.[9]

After the conduct of public hearing, and pursuant to the foregoing, the NTC promulgated the subject Circular on September 20, 2018.[10] The Oversight Committee and the NTC decided that the best way to select the NMP was through a public, open, and competitive selection process.[11]

Thereafter, the DICT and the NTC published the timeline for the implementation of the subject Circular.[12] The timeline stated that the said Circular shall take effect on October 6, 2018; the Invitation to Bid shall be published on October 7, 2018; the issuance of the selection documents shall be on October 8, 2018; and the submission and opening of bids shall be on November 7, 2018.[13]

On October 8, 2018, NOW Telecom filed before the RTC a Complaint for Injunction[14] with application for an ex-parte temporary restraining order (TRO), 20-day TRO, and/or WPI against the NTC.[15]
","This case involves the Petition for Review on Certiorari[1] (Petition) filed by petitioner NOW Telecom Company, Inc. (NOW Telecom) assailing the Decision[2] (assailed Decision) and the Resolution[3] (assailed Resolution) of the Court of Appeals (CA), which affirmed the Order[4] of the Regional Trial Court (RTC).

In the said Order, the RTC denied NOW Telecom 's application for the issuance of a writ of preliminary injunction (WPI) against respondent National Telecommunications Commission (NTC) to restrain the implementation of certain provisions of NTC Memorandum Circular (M.C.) No. 09-09-2018 entitled, ""Rules and Regulations on the Selection Process for a New Major Player in the Philippine Telecommunications Market"" (subject Circular).","The Petition is denied.

NOW Telecom's application for
injunctive relief has been rendered
moot and academic

At the outset, it is worth noting that, during the pendency of this case, Mindanao Islamic Telephone Company, Inc. (MISLATEL) was selected as the NMP by virtue of the subject Circular, and was accordingly issued a Certificate of Public Convenience and Necessity (CPCN).[35]

It is an established rule that injunction will not issue to restrain the performance of an act already done, or to prevent events that have already happened.[36] When the act sought to be prevented by injunction has already been performed or completed, ""nothing more can be enjoined or restrained; a writ of injunction then becomes moot and academic, and the court, by mere issuance of the writ, can no longer stop or undo the act. To do so would violate the sole purpose of a prohibitive injunction, that is, to preserve the status quo.[37]

In this case, the act sought to be restrained by NOW Telecom has already been done. The actual implementation of the selection process of the NMP pursuant to the subject Circular, and the resulting assignment of the allocated radio frequencies for the NMP to MISLATEL have rendered NOW Telecom's prayer for injunctive relief moot and academic. Accordingly, NOW Telecom's application for WPI should be denied.
","ACCORDINGLY, the Petition for Review on Certiorari filed by petitioner NOW Telecom Company, Inc., is hereby DENIED. The Decision dated May 24, 2021 and the Resolution dated April 12, 2022 of the Court of Appeals in CA-G.R. SP No. 158237 are AFFIRMED."
"G.R. No. 255180, January 31, 2024","CONRADO FERNANDO, JR. PETITIONER, VS. PEOPLE OF THE PHILIPPINES, RESPONDENT.","The case stemmed from an Information[5] dated July 30, 2007, that charged petitioner with the crime of Estafa, defined and penalized under Article 315 (2) (a) of the Revised Penal Code (RPC). The accusatory portion of the Information reads:
That on or about the 1st day of August, 2006 in Quezon City, Philippines, the said accused, did, then and there willfully, unlawfully and feloniously defraud one DOROLIZA REYROSO DIN, in the following manner, to wit: the accused, by means of false manifestations and fraudulent representations which he made to the complainant, to the effect that he could facilitate the processing of the pertinent papers of the promo package which the accused offered to the complainant in a four (4) day tour in Hongkong Disneyland, for the amount of P37,400.00, Philippine Currency, induced and succeeded in inducing said complainant to give and deliver, as in fact Doroliza R. Din gave and delivered to the accused the amount of P37,400.00, Philippine Currency, to meet the requirements thereof, said accused well knowing that the same were false and fraudulent but were made solely to obtain, as in fact the said accused did obtain the amount of P37,400.00, Philippine Currency, which amount once in possession thereof, with intent to defraud, misapplied, misappropriated and converted the same to his own personal use and benefit, despite demand made upon him, to the damage and prejudice of the said offended party in the amount aforementioned","Before the Court is a Petition for Review on Certiorari[1] assailing the Decision[2] dated January 7, 2021, of the Court of Appeals (CA) in CA-­G.R. CR No. 39899. The CA affirmed with modification the Decision[3] dated November 24, 2016, and the Omnibus Order[4] dated March 8, 2017, of Branch 216, Regional Trial Court (RTC) of Quezon City in Criminal Case No. Q-07-148522. The CA found Conrado Fernando, Jr. (petitioner) guilty beyond reasonable doubt of the crime of Estafa, but it deleted the award of actual damages in the amount of PHP 37,400.00.","At the outset, the Court notes that Atty. Valentino K. Villaluz, counsel for petitioner, has failed to comply with the Resolution[39] dated August 31, 2022 which required him to submit within five days from notice the following:
(1) a soft copy of the petition in portable document format as required under the Rules in E-Filing (A.M. No. 10-3-7-SC) and the Efficient Use of Paper Rule (A.M. No. 11-9-4-SC); (2) a certification against forum shopping; (3) a valid verification of the petition with (a) the additional attestations in the verification of the petition as required under Section 4, Rule 7 of the 2019 Amended Rules of Court; and (b) a properly accomplished jurat with affiant's current identification document issued by an official agency bearing his photograph and signature; pursuant to Secs. 2, 6, and 12, Rule 11 of the 2004 Rules on Notarial Practice, as amended by A.M. No. 02-8-13-SC; and (4) a valid affidavit of service with a properly accomplished jurat with affiant's current identification document issued by an official agency bearing his/her photograph and signature, pursuant to Secs. 2, 6, and 12, Rule II of the 2004 Rules on Notarial Practice, as amended by A.M. No. 02-8-13-SC.[40] (Emphases omitted)
However, considering that petitioner's liberty is at stake, the Court resolves to brush aside the procedural infirmities of the petition and give due course to the petition in the higher interest of substantial justice.

The Court shall now delve into the merits of the present petition. Petitioner filed a Petition for Review on Certiorari under Rule 45 of the Rules of Court. For the petition to prosper, Section 5 (2) of Rule 45 of the Rules of Court states that the questions raised in the petition should be of such substance as to warrant consideration. Also, Section 6 of the same Rules provides the reasons which will be considered by the Court —
SEC. 6. Review discretionary.... ","WHEREFORE, the petition is GRANTED. The Decision dated January 7, 2021 of the Court of Appeals in CA-G.R. CR No. 39899 is REVERSED and SET ASIDE. Petitioner Conrado Fernando, Jr. is ACQUITTED of the crime of Estafa in Criminal Case No. Q-07-148522 as his guilt was not proven beyond reasonable doubt. The Branch 216, Regional Trial Court, Quezon City is ORDERED to CANCEL the cash bail bond and return the same to petitioner.

Let entry of judgment be issued immediately."
"G.R. No. 256194, January 31, 2024","REPUBLIC OF THE PHILIPPINES, PETITIONER, VS. HEIRS OF ROGELIO P. LAUDES, NAMELY, VICTORIA ORDIZ VDA. DE LAUDES, ROVI ROVILLE LAUDES-CORNELIO, ROVIN LAUDES, ROVIROSE LAUDES AND ROVICOR LAUDES, REPRESENTED BY VICTORIA ORDIZ VDA. DE LAUDES, RESPONDENTS.","On September 19, 1984, Rogelio P. Laudes (Rogelio) died when the Chevrolet Truck owned by Jesus E. Enova (Jesus) and driven by Elias Pilo (Pilo) hit him. As a result of Rogelio's death, his heirs filed both civil and criminal cases against Jesus and Pilo. Both Civil Case No. 5175 and Criminal Case No. 4040 were consolidated before the RTC, Branch 40 (RTC Branch 40). In its Joint Decision, dated January 6, 1989, RTC Branch 40 found Pilo guilty for reckless imprudence resulting to homicide, slight physical injuries, and damage to property, while Jesus was ordered to pay civil liability in the total amount of PHP 205,000.00.[5]

Thereafter, a Writ of Execution was issued, followed by the issuance of a Notice of Levy against the properties of Jesus, including those covered by TD No. 006-0168 and TD No. 006-0279. The sheriff then issued a Notice of Sheriff's Sale, setting the levied properties of Jesus for public auction on September 25, 1990, in satisfaction of the civil liability adjudged by RTC Branch 40.[6]

During the said public auction, Victoria emerged as the highest bidder and was awarded the properties levied, giving Jesus and his heirs, assigns, administrator or executor one (1) year from the date of the auction sale to redeem the said properties. However, the subject properties were not redeemed. Thus, the Sheriff's Final Deed, dated October 16, 1991, was issued. Thereafter, a Writ of Possession was issued by RTC Branch 40.[7]

In the Sheriff's Return, dated January 3, 1992, the sheriff was able to place the Heirs of Laudes in possession of some of the properties including the property with TD No. 006-0279. However, the sheriff failed to do the same for the other properties, including the property with TD No. 006-0168.[8]

Upon issuance of an Alias Writ of Possession, the sheriff, in his Partial Return, dated January 11, 1993, reported that the Heirs of Laudes were again dispossessed of the property with TD No. 006-0168 after placing them in possession on January 8, 1993, and that the property with TD No. 006-0279 has not yet been placed in their possession.[9]

Meanwhile, records reveal that Gregorio Zantua, Jr. (Zantua), Jose Enova (Jose), Leopoldo Enova (Leopoldo), and Ricardo Lotik (Lotik) filed a complaint before RTC Branch 40, docketed as Civil Case No. 6118, against the Heirs of Laudes for recovery of real properties and annulment of sale. They alleged that the properties subject of the public auction were sold to them prior to the levy made by the sheriff. Zantua, Jose, and Lotik eventually withdrew as party-plaintiffs in Civil Case No. 6118, but filed separate civil cases for the same cause of action against Victoria.[10]","This is a Petition for Review on Certiorari (Petition),[1] filed under Rule 45 of the Rules of Court, assailing the Decision,[2] dated June 30, 2020, and the Resolution,[3] dated March 9, 2021, of the Court of Appeals (CA), in CA-G.R. CV No. 111651. The CA affirmed the Joint Decision,[4] dated June 21, 2018, of the Regional Trial Court of Daet, Camarines Norte (RTC), Branch 39 (RTC Branch 39), which ruled that Victoria Ordiz Vda. de Laudes (Victoria), Rovi Rovile Laudes-Cornelio (Rovi), Rovin Laudes (Rovin), Rovirose Laudes (Rovirose), and Rovicor Laudes (Rovicor), all represented by Victoria (collectively, the Heirs of Laudes), were able to prove that the properties covered by Tax Declaration (TD) No. 006-0168 and TD No. 006-0279 (collectively, the subject properties), that they sought to be registered, were alienable and disposable lands, and that their predecessors-in-interest have been in open, continuous, exclusive, and notorious possession and occupation under a bona fide claim of ownership over the subject properties.","The Petition is meritorious.

Classification of lands

Pursuant to the Regalian Doctrine (Jura Regalia), all lands of the public domain belong to the State. This means that the State is the source of any asserted right to ownership of land, and is charged with the conservation of such patrimony.[39] As elucidated in Federation of Coron, Busuanga, Palawan Farmer's Association, Inc. v. The Secretary of Department of Environment and Natural Resources:[40]
The Regalian Doctrine was embodied as early as in the Philippine Bill of 1902. Under Section 12 thereof, it was stated that all properties of the Philippine Islands that were acquired by the United States through the treaty with Spain shall be under the control of the Government of the Philippine Islands, to wit:
SECTION 12. That all the property and rights which may have been acquired in the Philippine Islands by the United States under the treaty of peace with Spain, signed December tenth, eighteen hundred and ninety-eight, except such land or other property as shall be designated by the President of the United States for military and other reservations of the Government of the United States, are hereby placed under the control of the Government of said Islands, to be administered for the benefit of the inhabitants thereof, except as provided in this Act.
The only exception in the Regalian Doctrine is native title to land, or ownership of land by Filipinos by virtue of a claim of ownership since time immemorial and independent of any grant from the Spanish Crown. In Cariño v. Insular Government, the United States Supreme Court at that time held that:
It might, perhaps, be proper and sufficient to say that when, as far back as testimony or memory goes, the land has been held by individuals under a claim of private ownership, it will be presumed to have been held in the same way from before the Spanish conquest, and never to have been public land.[41] (Citations omitted)
Lands may either be of (1) public dominion or (2) of private ownership.[42] Lands under public dominion are either (1) those intended for public use, such as roads, canals, rivers, torrents, ports and bridges constructed by the State, banks, shores, roadsteads, and others of similar character; or (2) those which belong to the State, without being for public use, and are intended for some public service or for the development of the national wealth.[43]

Hence, based on Article 420 of the Civil Code, there are three kinds of property of public dominion: (1) those for public use, which may be used by anybody, such as roads and canals; (2) those for public service, which may be used only by certain duly authorized persons, although used for the benefit of the public; and (3) those used for the development of national wealth, such as our natural resources. Lands of public dominion remain part of the inalienable land of the public domain unless the State is shown to have reclassified or alienated them to private persons.[44]","ACCORDINGLY, the Petition for Review on Certiorari filed by the Republic of the Philippines is PARTLY GRANTED.

The case is REMANDED to the Court of Appeals for reception of evidence on the subject properties' land classification status based on the parameters set forth in Section 7 of Republic Act No. 11573. The Court of Appeals is directed to resolve the case with utmost dispatch."
"G.R. No. 264158, January 31, 2024","MELBA ALCANTARA DENUSTA, PETITIONER, VS. MIGRANT WORKERS MANPOWER AGENCY, INC., THERESITA M. CERALDE, AND K&G MANPOWER SERVICES, LTD., RESPONDENTS.","Petitioner filed a complaint for illegal dismissal, underpayment of salaries, damages, payment of wages for the unexpired portion of the contract, and attorney's fees against Migrant Workers Manpower Agency, Inc. (Migrant), a placement and recruitment agency, K&G Manpower Services, Ltd. (K&G), Migrant's foreign principal, and Theresita M. Ceralde (Ceralde), in her capacity as Migrant's president (collectively, respondents).[4]

In the complaint, petitioner averred that she was hired as a Kitchen Hand for The Lunch Box Ltd. (Lunch Box) in Rarotonga, Cook Islands under a two-year employment contract executed with Migrant and K&G. Based on her contract, she would receive a weekly salary of NZ$400.00 or NZ$1,600.00 per month. On May 22, 2019, she arrived in the Cook Islands and started her employment. She was repatriated to the Philippines on November 17, 2019.[5]

During her employment, petitioner alleged that her employer, Charlene Tairea (Tairea) committed several violations of her contract of employment. She was paid less than the agreed rate and was not provided with accommodation, transportation, or food allowances. She was considered a part-time employee and was not paid her salary during holidays. Petitioner likewise averred that she was maltreated by her foreign employer's family members. Due to her predicaments in the hands of her foreign employer, she claimed that respondents were guilty of illegal dismissal.[6]

Worse, when petitioner informed Migrant of her situation, Migrant did not act on it. Furthermore, before she was permitted to return home, respondents forced her to sign a Quitclaim, but she refused. Instead, she executed a Letter of Dispute narrating her ordeal.[7]","This Petition for Review on Certiorari[1] under Rule 45 of the Rules of Court assails the Resolutions dated June 14, 2022[2] and October 19, 2022[3] of the Court of Appeals (CA) in CA-G.R. SP No. 171524, which dismissed the Petition for Certiorari filed by Melba Alcantara Denusta (petitioner) for being filed beyond the reglementary period.","The instant petition is meritorious.

The CA erred in denying the motion for extension of time to file Petition for Certiorari and dismissing the same for being filed beyond the reglementary period
In the instant petition, petitioner begs this Court to relax the procedures and rule on the substantive issues raised in the petition. She claims that motions for extension to file a petition for certiorari are allowed and that the extension thereof is subject to the sound discretion of the court. Petitioner added that the COVID-19 pandemic and the deadly surge of cases are exceptional circumstances and compelling reasons to allow the extension of time to file a petition for certiorari.[31]

We are persuaded.

Under the Rules of Court, a petition for certiorari under Rule 65 shall be filed not later than 60 days from notice of the judgment, order, or resolution.[32] With the issuance of A.M. No. 00-2-03-SC,[33] motions for extension of time to file petitions for certiorari were allowed for compelling reasons only. The rules, therefore, admit an exception and the filing of petitions for certiorari is now extendible, albeit only for compelling reasons.","ACCORDINGLY, in view of the foregoing premises, the instant petition is GRANTED. The Court of Appeals Resolutions dated June 14, 2022, and the October 19, 2022, in CA-G.R. SP No. 171524 are REVERSED and SET ASIDE.

The January 27, 2021 Decision of the Labor Arbiter is REINSTATED in so far as it ruled that petitioner Melba Alcantara Denusta was illegally dismissed and that respondents Migrant Workers Manpower Agency, Inc., K&G Manpower Services Ltd., and Theresita M. Ceralde are ordered to pay, jointly and severally, her salary for the unexpired portion of her contract, as well as for salary differentials, and attorney's fees, with MODIFICATIONS that petitioner be entitled to an increased amount of moral damages, and exemplary damages, as well as reimbursement of placement fee. Accordingly, respondents are further ORDERED to pay petitioner Melba Alcantara Denusta the following:

1.
Moral and exemplary damages in the amount of PHP 50,000.00 and PHP 25,000.00, respectively.


2.
PHP 90,000.00, as reimbursement for the placement fee which petitioner paid to Migrant Workers Manpower Agency, Inc.
An interest of six percent (6%) per annum of the total monetary awards shall be imposed, computed from the time the complaint was filed until its full satisfaction.

The Labor Arbiter is ORDERED to compute the total monetary benefits awarded and due the petitioner in accordance with this Resolution."
