Case Number,Case Title,Facts,Decision,Ruling,Verdict
"A.C. No. 13955 (Formerly CBD Case No. 19-6114), January 30, 2024","DRIAN M. KELLEY, COMPLAINANT, VS. ATTY. CIPRIANO D. ROBIELOS III, RESPONDENT.","According to Kelley, sometime in February 2016, Atty. Robielos borrowed from him PHP 240,000.00, for which Atty. Robielos issued as payment Bank of Commerce Check No. 0000008[2] dated June 30, 2016. When he presented the check for payment, however, the same was dishonored for being ""drawn against insufficient funds."" He consequently sent Atty. Robielos a demand letter[3] dated July 30, 2016.[4]

He and Atty. Robielos subsequently entered into an Agreement[5] (""Kasunduan ng Pag-Aayos"") dated September 13, 2016 before the Office of the Barangay Chairman, Barangay 33, Caloocan City, whereby Atty. Robielos committed to pay in installments of PHP 20,000.00 every 15 days for a period of six months. Atty. Robielos, however, only paid three installments or a total of PHP 60,000.00, leaving a balance of PHP 180,000.00.[6]

He was, therefore, constrained to file a small claims complaint[7] against Atty. Robielos before the Branch 51, Metropolitan Trial Court, Caloocan City, (MeTC-Branch 51) docketed as Small Claims Case No. 17-2040. Despite receipt of summons, Atty. Robielos failed to file an answer and did not appear during the hearing.[8]

By Decision[9] dated February 23, 2017, MeTC-Branch 51 ordered Atty. Robielos to pay the amount of PHP 180,000.00 with 5% interest per annum. Kelley then filed a Motion for Execution,[10] which Atty. Robielos opposed,[11] claiming he had suffered a mild stroke. During the hearing on the motion for execution, Atty. Robielos appeared and was directed by the court to file his answer, which he did. Atty. Robielos countered that the check was issued merely to ""return a favor"" and was not intended to be encashed as payment for a debt.[12]

By Order[13] dated April 3, 2017, MeTC-Branch 51 found the aforesaid defense to be devoid of merit, hence, it granted the motion for execution. The same was affirmed by the Branch 129, Regional Trial Court, Caloocan City per its Order[14] dated June 14, 2017. An alias writ of execution was eventually served on Atty. Robielos who still refused to pay the judgment award.[15]

Consequently, this time, Kelley was compelled to file the instant administrative complaint against Atty. Robielos.[16]","Complainant Adrian M. Kelley (Kelley) charged respondent Atty. Cipriano D. Robielos III (Atty. Robielos) before the Integrated Bar of the Philippines (IBP) with grave misconduct, averring that the latter issued a worthless check and failed to pay his debt in violation of the Code of Professional Responsibility (CPR) and the Lawyer's Oath.[1]","At the outset, the Court emphasizes that the provisions of the Code of Professional Responsibility and Accountability (CPRA), which took effect on May 30, 2023, apply to the present case by virtue of Section 1, of the General Provisions of the CPRA, viz.:

Section 1. Transitory Provision. — The CPRA shall be applied to all pending and future cases, except to the extent that in the opinion of the Supreme Court, its retroactive application would not be feasible or would work injustice, in which case the procedure under which the cases were filed shall govern.

Membership in the Bar is a privilege burdened with conditions. Time and again, the Court has imposed the penalty of suspension or disbarment for any gross misconduct that a lawyer may have committed, whether it is in his or her professional or private capacity. Good character is an essential qualification for the admission to and continued practice of law. Hence, any wrongdoing, whether professional or non-professional, indicating unfitness for the profession justifies disciplinary action,[27] as here.

Indeed, the Court has repeatedly ordained that -

Law is a noble profession, and the privilege to practice it is bestowed only upon individuals who are competent intellectually, academically and, equally important, morally. Because they are vanguards of the law and the legal system, lawyers must at all times conduct themselves, especially in their dealings with their clients and the public at large, with honesty and integrity in a manner beyond reproach.[28]

Unfortunately, Atty. Robielos failed to live up to these standards.","ACCORDINGLY, respondent Atty. Cipriano D. Robielos III is found GUILTY of violation of Canons II and III of the Code of Professional Responsibility and Accountability. He is DISBARRED from the practice of law and his name is ORDERED stricken off from the Roll of Attorneys, effective immediately. He is also meted a FINE in the amount of PHP 35,000.00 for his repeated disobedience to the orders of the Integrated Bar of the Philippines. Finally, he is directed to PAY his debt to complainant Adrian M. Kelley and comply with the Writ of Execution dated April 3, 2017 issued by the Branch 51, Metropolitan Trial Court, Caloocan City.

Let a copy of this Decision be attached to his personal record in the Office of the Bar Confidant.

Too, furnish a copy of this Decision to the Integrated Bar of the Philippines for its information and guidance; and the Office of the Court Administrator for dissemination to all courts of the Philippines."
"G.R. No. 261107, January 30, 2024","ANA LIZA ARRIOLA PERALTA, PETITIONER, VS. COMMISSION ON ELECTIONS, REPRESENTED BY THE CAMPAIGN FINANCE UNIT, RESPONDENT.
","Petitioner ran for the position of Mayor in the Municipality of San Marcelino, Zambales, during the May 10, 2010, National and Local Elections (2010 NLE).[7] At the time, there were 20,301 registered voters in the municipality.[8]

In a Letter[9] to petitioner dated October 1, 2014, Atty. Ferdinand T. Rafanan (Atty. Rafanan), Head of the Campaign Finance Unit of the COMELEC, stated that petitioner spent the amount of PHP 285,500.00 during the 2010 NLE per the Statement of Contributions & Expenditures (SOCE) which she submitted to the COMELEC on June 7, 2010. Under Section 100 of the OEC, as amended by Section 13 of Republic Act No. 7166, the maximum allowable expenditure for petitioner was PHP 3.00 per registered voter or a total of PHP 60,903.00. Thus, as petitioner appeared to have exceeded the limit set by law, Atty. Rafanan directed her to submit her written explanation as to why no charges should be filed against her for the election offense of overspending under Section 262 in relation to the OEC, Section 100, as amended by Republic Act No. 7166, Section 13.

In her letter-response[10] dated March 2, 2015, petitioner attached the respective affidavits of her contributors, along with their corresponding explanations or clarifications on the declarations made in the Schedule of Contributions Received and Reports of Contributors,[11] as follows:
Lance Stefan L. Flamiano – the amount of his tarpaulin contributions was mistakenly written as PHP 30,000.00 instead of PHP 3,000.00;[12]

Noel P. Cacho – his contribution amounting to PHP 7,000.00 partook of the nature of copying and classifying the list of voters, investigating the registered voters on the list, and printing of sample ballots; however, it was erroneously indicated as meals and snacks in the report of his contribution;[13]

Maria Christina P. Penaflor – her contribution amounting to PHP 18,000.00 partook of the nature of copying and classifying the list of voters, investigating the registered voters on the list, and printing of sample ballots; however, it was erroneously indicated as meals and snacks in the report of her contribution;[14]

Rolando A. Flamiano – he contributed PHP 10,000.00 worth of home-made sample ballots; however, in his report of contribution, he caused the word ""leaflets"" to be written in conformity with the report's suggested description and as understood by him as being the nearest description of his contribution;[15]

Daniel A. Villanueva – his contribution of PHP 12,000.00 was not for meals and snacks as reflected in his report of contribution; upon careful recollection, he contributed PHP 8,000.00 for home-made printing of sample ballots and PHP 4,000.00 for copying and classifying the lists of voters;[16]

Heidi P. Villanueva – her report of contribution erroneously reflected meals and snacks in the amount of PHP 84,000.00; however, she only contributed PHP 2,000.00 for meals and snacks while the remaining PHP 82,000.00 was for copying and classifying the lists of voters, investigating the registered voters on the list, and printing of home-made sample ballots;[17]

Isabelita Peralta – she contributed the amount of PHP 5,000.00 for copying and classifying the lists of voters; however, the description in the schedule of contributions reflected ""papers/pens"";[18]

Jonathan S. Peralta – he contributed the amount of PHP 11,000.00 for copying and classifying the lists of voters, investigating the registered voters on the list, and printing of home-made sample ballots; he denied giving PHP 3,000.00 for vehicle and PHP 8,000.00 for meals and snacks, as reflected in the schedule of contributions;[19] and

Apolinario Abelon – he contributed home-made sample ballots amounting to PHP 3,000.00 only and corrected the figure of PHP 30,000.00 for meals and snacks appearing on the schedule of contributions.[20]
Petitioner further indicated in her letter that she underwent hip stress fracture surgery on December 10, 2014, after suffering serious injuries from a vehicular accident in Cancun, Mexico, on November 10, 2014. Thus, her mobility was very restricted and limited from such date. In addition, petitioner maintained that the distance between her and her contributors restricted her from easily conducting verification considering that she was based in Makati City, while almost all of her contributors were based in the Province of Zambales. She then requested that she be allowed to submit relevant documents as soon as they become available.[21]","Before the Court is a Petition for Certiorari[1] assailing Resolution No. 18-0656[2] dated August 8, 2018, and Resolution No. 21-0472-57[3] dated July 14, 2021, issued by the respondent Commission on Elections (COMELEC) En Banc in E.O. Case No. 15-954. In the assailed issuances, the COMELEC found probable cause to hold Ana Liza A. Peralta (petitioner) for trial and directed the filing of an Information against her for election overspending under Section 100[4] in relation to Section 262[5] of Batas Pambansa No. (BP) 881, otherwise known as the Omnibus Election Code (OEC), as amended by Republic Act No. 7166.[6]","The Court grants the petition.

There was inordinate delay in the conduct of the preliminary investigation before the COMELEC which violated petitioner's right to speedy disposition of cases. Hence, the dismissal of the complaint against her is warranted.

The 1987 Constitution, Article III, Section 16,[50] guarantees the right of all persons to a speedy disposition of their cases before all judicial, quasi-judicial, or administrative bodies. This constitutional right is available not only to the accused in criminal proceedings but also to all parties in all cases, whether civil or administrative in nature, as well as all proceedings, either judicial or quasi-judicial. Pursuant thereto, any party to a case may demand expeditious action from all officials who are tasked with the administration of justice.[51]

In resolving whether petitioner's right to the speedy disposition of her case was violated, the guidelines set forth by the Court in Cagang v. Sandiganbayan,[52] find relevance:
First, the right to speedy disposition of cases is different from the right to speedy trial. While the rationale for both rights is the same, the right to speedy trial may only be invoked in criminal prosecutions against courts of law. The right to speedy disposition of cases, however, may be invoked before any tribunal, whether judicial or quasi-judicial. What is important is that the accused may already be prejudiced by the proceeding for the right to speedy disposition of cases to be invoked.

Second, a case is deemed initiated upon the filing of a formal complaint prior to a conduct of a preliminary investigation. This Court acknowledges, however, that the Ombudsman should set reasonable periods for preliminary investigation, with due regard to the complexities and nuances of each case. Delays beyond this period will be taken against the prosecution. The period taken for fact-finding investigations prior to the filing of the formal complaint shall not be included in the determination of whether there has been inordinate delay.

Third, courts must first determine which party carries the burden of proof. If the right is invoked within the given time periods contained in current Supreme Court resolutions and circulars, and the time periods that will be promulgated by the Office of the Ombudsman, the defense has the burden of proving that the right was justifiably invoked. If the delay occurs beyond the given time period and the right is invoked, the prosecution has the burden of justifying the delay.","ACCORDINGLY, the petition is GRANTED. Resolution No. 18-0656 dated August 8, 2018, and Resolution No. 21-0472-57 dated July 14, 2021, of the Commission on Elections En Banc in E.O. Case No. 15-954, are NULLIFIED for having been issued with grave abuse of discretion. The complaint against petitioner Ana Liza Arriola Peralta for alleged election overspending is DISMISSED.
"
"A.M. No. P-23-077 (Formerly OCA IPI No. 20-5026-P), January 30, 2024","DANILO D. DIVINAGRACIA, COMPLAINANT, VS. MICHAEL VINCENT L. OZON, CLERK III, BRANCH 1, REGIONAL TRIAL COURT, BUTUAN CITY, AGUSAN DEL NORTE, RESPONDENT.","In his Letter-Complaint dated December 27, 2019, complainant alleged that he requested from Branch 1, RTC, Butuan City, Agusan del Norte, a certificate of finality of the decision it rendered in his case for declaration of nullity of marriage. He averred that respondent, who is a son-in-law of a judge, asked him to pay PHP 25,000.00 for the release of the certificate of finality of his case. Later, he encountered and spoke with other people who shared with him the same predicament he experienced with respondent.[3]

Complainant further alleged that respondent previously worked at the Department of Public Works and Highways (DPWH) where ""under-the-table"" and ""S.O.P."" arrangements were apparently a common practice.[4]

In the 1st Indorsement[5] dated February 7, 2020, the Office of the Court Administrator (OCA) referred the matter to Executive Judge Augustus L. Calo (Executive Judge Calo), RTC, Butuan City, Agusan del Norte, for a discreet investigation and report.

In relation to the aforementioned Letter-Complaint, respondent, on June 1, 2020, received a Notice to Explain[6] dated May 28, 2020, from Executive Judge Calo directing him to submit a written explanation within five calendar days from receipt of notice.[7]","Before the Court is a Letter-Complaint[1] dated December 27, 2019, from a person under the nom de plume ""Danilo D. Divinagracia"" (complainant) charging respondent Michael Vincent L. Ozon (respondent), Clerk III, Branch 1, Regional Trial Court (RTC), Butuan City, Agusan del Norte, with Gross Misconduct and violation of Republic Act No. 6713.[2]","After a careful review of the case records, the Court affirms the findings of Executive Judge Calo and the JIB and finds respondent administratively liable for gross misconduct for (1) demanding money from litigants for the release of certificates of finality and (2) sending copies of the decision in annulment cases pending before the RTC to the OSG via a private courier in exchange for money. Accordingly, respondent should be meted out the penalty of dismissal from service.

Respondent is guilty of the serious charge of Gross Misconduct.
""Misconduct is a transgression of some established and definite rule of action, more particularly, unlawful behavior or gross negligence by the public officer.""[46] The offense becomes gross misconduct when any of the elements of corruption, clear intent to violate the law, and flagrant disregard of established rule is present.[47]","WHEREFORE, the Court finds respondent Michael Vincent L. Ozon, Clerk III of Branch 1, Regional Trial Court, Butuan City, Agusan del Norte, GUILTY of the serious charge of gross misconduct and DISMISSES him from the service with forfeiture of all benefits, except accrued leave credits, and disqualification from reinstatement or appointment to any public office including government-owned or controlled corporation."
"A.M. No. P-19-3923, January 30, 2024","OFFICE OF THE COURT ADMINISTRATOR [FORMERLY A.M. NO. 18-12-278-RTC - RE: REPORT OF JUDGE MA. THERESA A. CAMANNONG ON THE ALLEGED CORRUPT PRACTICES OF MS. NEMIA ALMA Y. ALMANOCHE, COURT STENOGRAPHER III, BRANCH 10, REGIONAL TRIAL COURT, MALAYBALAY CITY, BUKIDNON], PETITIONER, VS. NEMIA ALMA Y. ALMANOCHE, COURT STENOGRAPHER III, BRANCH 10, REGIONAL TRIAL COURT, MALAYBALAY CITY, BUKIDNON, RESPONDENT.
","Judge Camannong reported that on May 3, 2018, she learned from Louie Veluz (Veluz), a legal researcher in Branch 9, that the latter had received information from a certain Dianne Balansag (Balansag), a job order worker also in Branch 9, that Almanoche had solicited PHP 20,000.00 from a certain Jean Baguio (Baguio), allegedly in exchange for the dismissal of the criminal case against Baguio's two sons pending before Judge Camannong's sala. Almanoche allegedly told Baguio that the amount was for ""the judge, the fiscal, and the PAO.""[3]

Enraged by the information, Judge Camannong called up the prosecutor handling said criminal case, Prosecutor Iris T. Panganiban (Pros. Panganiban). Pros. Panganiban told Judge Camannong that Balansag and Baguio had already told her about the matter.[4]","This Court resolves an administrative matter involving Nemia Alma Y. Almanoche (Almanoche), a Court Stenographer III of Branch 10, Regional Trial Court (RTC), Malaybalay City, Bukidnon.
This case arose from the Letter[1] of Presiding Judge Ma. Theresa A. Camannong (Judge Camannong) of Branch 9, RTC of Malaybalay City, Bukidnon (Branch 9), to Acting Presiding Judge Eldred D. Cole (Judge Cole) of Branch 10, RTC, Malaybalay City, Bukidnon (Branch 10). In her Letter, Judge Camannong informed Judge Cole of the alleged corrupt practices involving Almanoche.[2]","Upon a review of the established facts, this Court adopts the JIB's findings and recommended imposable penalty.

Reference to this Court's recently promulgated Further Amendments to Rule 140[41] of the Rules of Court (Rule 140) is appropriate as it now also governs the discipline of officials, employees, and personnel of the Judiciary. Although the alleged acts were perpetrated prior to the effectivity of the amendments, the amendments nonetheless govern, pursuant to Section 24[42] thereof.

Section 1(2) of Rule 140 requires that the allegations against Almanoche must be supported by affidavits of persons who have personal knowledge of the facts alleged therein or by authentic documents which may substantiate its allegations.

In the instant case, despite the accounts of several individuals that were implicated, it bears noting that only Baguio had personal knowledge of the April 27, 2018 incident involving Almanoche. Indeed, Judge Camannong and Veluz separately issued Manifestations[43] expressly stating that they had no personal knowledge of the incident involving Almanoche. In any event, we lend full credence to Baguio's testimony since, as astutely raised by Justice Amy C. Lazaro-Javier, it would be inconceivable for anyone to go so far, spreading such elaborate lies on different occasions to different people.

Moreover, while Judge Camannong, Pros. Panganiban, and Atty. Ibañez did not have personal knowledge of the incident involving Almanoche, it bears emphasis that Baguio, not long after the incident, narrated the event to one or all of them on separate occasions. The consistency in Baguio's details, as recalled by Judge Camannong, Pros. Panganiban, and Atty. Ibañez, strongly corroborates Baguio's account.

As adeptly underscored by Chief Justice Alexander G. Gesmundo, we are quick to clarify that, despite the lack of personal knowledge of Judge Camannong, Pros. Panganiban, and Atty. Ibañez on the incident of April 27, 2018, their accounts may nonetheless be admitted and given credence in view of Baguio's affidavit. Re: Verified Complaint dated July 13, 2015 of Alfonso Umali, Jr. v. Justice Hernandez[44] elucidates:","ACCORDINGLY, Nemia Alma Y. Almanoche is found GUILTY of serious dishonesty. She is ordered DISMISSED from service with forfeiture of all retirement benefits, except accrued leave credits. She is also disqualified from being re-employed in the government, including government-owned and controlled corporations."
