Case Number,Case Title,Facts,Decision,Ruling,Verdict
"G.R. No. 254452, November 27, 2024","HEIRS OF FERDINAND ROXAS, NAMELY: ANGELA MARGARITA T. ROXAS, DYAN PAULA T. ROXAS, MICHAEL JUDE T. ROXAS, AND MARIA KATRINA T. ROXAS, PETITIONERS, VS. HEIRS OF MELANIA ROXAS, NAMELY: MANUEL A. ROXAS, MARIA ROSARIO ROXAS-URETA, ALEXANDER A. ROXAS, SALOME ROXAS-PANTALEON, PAUL GERARDO ROXAS, ELAINE ROXAS GAMBOA, MA. IMELDA ROXAS-CRUZ, AND DAVID ANTHONY ROXAS, RESPONDENTS.","Antonio Roxas (Antonio) and Melania Roxas (Melania) are the parents of Ferdinand, Manuel A. Roxas (Manuel), Maria Rosario Roxas-Ureta (Maria), Alexander A. Roxas (Alexander), Salome Roxas-Pantaleon (Salome), Paul Gerardo Roxas (Paul), Elaine Roxas-Gamboa (Elaine), Ma. Imelda Roxas-Cruz (Imelda), David Anthony Roxas (David), Conrado A. Roxas (Conrado), and Jesus A. Roxas (Jesus).[5]

In 1970, Melania's cousin Felicisma Garcia, married to Alfonso Garcia, executed a Deed of Absolute Sale (DOAS) in favor of Ferdinand over a 500-square-meter parcel of land located at Loakan, Baguio City (subject lot). Transfer Certificate of Title (TCT) No. T-16657 was thereafter issued in Ferdinand's name. Melania built a house on the subject lot which the family used as a vacation house and residence of some of their children.[6]

From 1990 to 1995, Melania rented out a portion of the subject property to Alfredo Sison (Alfredo). In 1991, Paul started residing on the subject property together with his family.[7]

Antonio died on April 1, 1995. Subsequently, Ferdinand died on September 18, 2004, while Melania died on January 1, 2011.[8]

On November 11, 2014, Manuel, Maria, Alexander, Salome, Paul, Elaine, Imelda, and David (collectively, the Heirs of Melania) filed a Complaint[9] for the declaration of nullity of the DOAS and the cancellation of TCT No. T-16657. They alleged that it was Melania who purchased the subject lot, but she placed it in Ferdinand's name to protect the interests of her children in view of the existence of Antonio's illegitimate children. Ferdinand was 19 years old and still studying at the time of the sale. The house that Melania had built is declared in her name. Ferdinand never questioned his sibling's use of the subject property. The Heirs of Melania filed the complaint because the Heirs of Ferdinand sought to take over the subject property after Melania's death. The latter filed an unlawful detainer case against Paul before Branch 1, Municipal Trial Court in Cities, Baguio City. Jesus approved of the Complaint but did not join his siblings because he resides abroad. As for Conrado, his relationship with the Heirs of Melania is strained because he wants them to change their religion.[10]

The Heirs of Ferdinand countered that Ferdinand is the true owner of the subject lot. Antonio and Melania gave him the money to pay for the subject lot as they were overjoyed that he was about to graduate from college. Melania constructed the house with the permission of Ferdinand. Similarly, Ferdinand allowed Melania to rent out the property and keep the proceeds from it. Ferdinand also allowed Paul to reside on the subject property on the condition that he would vacate upon being asked to do so. When he asked Paul to leave, Melania pleaded with him to allow his brother to stay at least while she was still alive. Ferdinand paid the real property tax for the subject lot.[11]

The Heirs of Ferdinand averred that in 1988, Antonio and Melania transferred their assets to their family corporation, Mel-Rox Realty Inc. (Mel-Rox). After Antonio died, Mel-Rox gave the former's illegitimate children their share in his inheritance. Angela explained that Antonio's illegitimate children had their claim annotated on the titles of the properties registered under Mel-Rox. Thus, Mel-Rox paid Antonio's illegitimate children their claim on the estate of Antonio.[12] This prompted the legitimate children of Antonio and Melania to also ask for their share. On March 7, 1997, Melania, Conrado, Ferdinand, Elaine, and Imelda, as officers of Mel-Rox, executed a document entitled ""Donation/Gifts of Real Property and its Cash Equivalents to the Roxas Children from Mr. and Mrs. Antonio and Melania Roxas""[13] (Donation Document). Ferdinand's siblings were either given money or property. He did not receive anything as the subject property was already given to him.[14]

After Ferdinand died, the Heirs of Ferdinand met with some of the Heirs of Melania regarding the subject property as it was Ferdinand's wish for them to take over and improve it. They wanted to take possession of the subject property, but the Heirs of Melania told them that they could only do so after Melania's death. But even after Melania's death, Paul stayed on the subject property. Hence, they filed an ejectment case against him.[15]","Before the Court is a Petition for Review on Certiorari[1] under Rule 45 of the Rules of Court filed by the heirs of Ferdinand A. Roxas (Ferdinand), namely: Angela Margarita T. Roxas (Angela), Dyan Paula T. Roxas (Dyan), Michael Jude T. Roxas (Michael), and Maria Katrina T. Roxas (Katrina) (collectively, the Heirs of Ferdinand), assailing the Decision[2] dated February 13, 2020, and the Resolution[3] dated September 29, 2020, of the Court of Appeals (CA) in CA-G.R. CV No. 109260. The CA reversed the Decision[4] dated January 19, 2017, of Branch 5, Regional Trial Court (RTC), Baguio City, First Judicial Region in Civil Case No. 8146-R.","Considering the varying findings of the RTC and the CA, the Court deems it proper to give due course to the arguments raised by the Heirs of Ferdinand, albeit they involve factual issues.[36]

The Court grants the Petition.

Article 1448 of the Civil Code states:
ARTICLE 1448. There is an implied trust when property is sold, and the legal estate is granted to one party but the price is paid by another for the purpose of having the beneficial interest of the property. The former is the trustee, while the latter is the beneficiary. However, if the person to whom the title is conveyed is a child, legitimate or illegitimate, of the one paying the price of the sale, no trust is implied by law, it being disputably presumed that there is a gift in favor of the child.
The implied trust under Article 1448 is called a purchase money resulting trust, which has the following elements: (a) an actual payment of money, property or services, or an equivalent, constituting valuable consideration; and (b) such consideration must be furnished by the alleged beneficiary of a resulting trust. The party alleging the existence of the trust bears the burden of proving it.[37]

Notably, the last sentence of Article 1448 states that if the title is conveyed to a child of the one paying the price of the sale, the disputable presumption is that there is a gift in favor of the child. There being no question that Ferdinand is the child of Melania, and that Melania paid the purchase price for the subject lot, there is a disputable presumption that Melania intended to donate the subject lot to Ferdinand.

Being a disputable presumption, it may be overturned by contrary evidence. In Tong v. Go Tiat Kun,[38] the Court held that the presumption was overturned because of several factors. First, the child under whose name the property was titled did not prove that he had the means to pay for it. Second, the parent and his other children always had possession of the property. Third, the property remained undivided even though it was registered in the name of one child. The surviving heirs of the child under whose name it was titled only claimed ownership after the death of said child. Fourth, the surviving heirs of the child admitted that their predecessor-in-interest did not send any letter claiming ownership over the property and that they had their own residence. Finally, the parent paid the real property taxes.[39]

The Court disagrees with the CA that the Heirs of Melania successfully overturned the presumption in favor of Ferdinand.

Ferdinand admittedly did not pay for the subject lot. In addition, the subject lot was not divided. But the similarities with Tong end there. It was Ferdinand and his heirs who paid for the real property taxes on the subject lot.[40] Melania also consistently asked Ferdinand to permit Paul to stay in the subject lot and the house she had built. This showed that she respected Ferdinand as the owner of the subject lot. More, the Heirs of Ferdinand are in possession of TCT No. T-16657.

Melania's act of building a house on the subject lot, paying the taxes for said house,[41] and renting out a portion thereof,[42] do not negate her donative intent. As explained by Associate Justice Alfredo Benjamin S. Caguioa (Associate Justice Caguioa), ""these actions pertain only to the exercise of the right to the possession, use, and fruits of the lot.""[43]

Having settled that the presumption under Article 1448 stands, it must be determined if the donation should still comply with the formal requirements under the Civil Code. These requirements would depend on whether the property donated is movable or immovable.

In the Answer of the Heirs of Ferdinand before the RTC, they stated that what was given by Melania to Ferdinand was the money to purchase the subject lot.[44] Therefore, the applicable provision is Article 748 of the Civil Code, which states that ""[i]f the value of the personal property donated exceeds five thousand pesos, the donation and the acceptance shall be made in writing. Otherwise, the donation shall be void."" The DOAS states that the purchase price for the subject lot is exactly PHP 5,000.00;[45] hence, the donation need not be made in writing.

In any event, Associate Justice Caguioa astutely observed that ""it would be illogical for the law to require the presumed donation to still comply with the formal requisites because otherwise, there would be no need for the presumption.""[46] The presumption under Article 1448 is necessary precisely because the parent chose an unconventional mode in donating property to their child. The presumption under Article 1448 should not be overturned due to the failure to comply with the formal requisites under Articles 748 or 749 of the Civil Code but should instead be based on proof that the parent did not intend to donate the property to the child.

Accordingly, the Court agrees with the RTC that the complaint of the Heirs of Melania should be dismissed. However, the Court cannot sustain the award of attorney's fees for lack of factual and legal bases under Article 2208 of the Civil Code.","WHEREFORE, the Petition for Review on Certiorari is GRANTED. The Decision dated February 13, 2020, and the Resolution dated September 29, 2020, of the Court of Appeals in CA-G.R. CV No. 109260 are REVERSED and SET ASIDE. The Decision dated January 19, 2017, of Branch 5, Regional Trial Court, Baguio City, First Judicial Region in Civil Case No. 8146-R is REINSTATED with the MODIFICATION in that the award of attorney's fees is DELETED."
"G.R. No. 252944, November 27, 2024","COMMISSIONER OF INTERNAL REVENUE, PETITIONER, VS. PACIFIC HUB CORPORATION,* RESPONDENT.","In 2008, Pacific Hub sent a letter[8] to BIR, indicating its willingness to pay its unremitted taxes for years 2005 and 2006 but requested for abatement of penalties, surcharges, and interests due to continued financial losses. This was later followed by the filing sometime in 2010 of its Application for Abatement or Cancellation of Tax, Penalties and/or Interest,[9] as well as the payment of the basic deficiency withholding tax on compensation, expanded withholding tax, and value-added tax in the total amount of PHP 15,480,231.11.[10]

Pacific Hub eventually received the Notice of Denial dated January 10, 2014, rejecting its application for abatement. It also received the Warrant of Distraint and/or Levy dated September 12, 2014, enforcing the collection of the increments incident to its deficiency withholding tax on compensation and expanded withholding tax in the aggregate amount of PHP 13,792,867.56.[11]

Inevitably, Pacific Hub filed its Petition for Review[12] before the CTA seeking to annul and set aside the Notice of Denial and the Warrant of Distraint and/or Levy for having been irregularly issued in violation of its right to due process.[13]

In refutation, CIR contended that the CTA had no jurisdiction over the case as there was no final decision on a disputed assessment to be reviewed.[14] Moreover, the power to grant or deny a request for abatement is completely discretionary on the part of the CIR, hence, beyond the ambit of the CTA's appellate jurisdiction.[15] In any case, the exercise of this power was not attended by grave abuse of discretion.[16]

Ensuingly, the CTA Third Division rendered its Decision[17] annulling both the Notice of Denial and the Warrant of Distraint and/or Levy. The CTA held that it had jurisdiction over the case under its ""other matters"" jurisdiction.[18] It found that the Warrant of Distraint and/or Levy was void for having been issued without the benefit of a prior assessment issued against Pacific Hub.[19] In the same vein, the Notice of Denial was void for failing to state the reasons for the denial of the application, in contravention of the requirements under Revenue Regulations No. 13-2001.[20] Withal, the CTA clarified that the voiding of the Notice of Denial does not mean that Pacific Hub is readily entitled to its request for abatement. This matter is still left to the best discretion of the CIR.[21]

With its bid for reconsideration[22] having been rebuffed by the CTA Third Division,[23] the CIR filed its Petition for Review[24] before the CTA En Banc.

In the impugned Decision, the CTA En Banc affirmed the rulings of the CTA Third Division.[25] It reverberated that the CTA has jurisdiction to review the Notice of Denial issued by the CIR.[26] While the courts may not generally interfere with discretionary functions, such as the grant or denial of an application for abatement, it may do so when the exercise thereof is attended by grave abuse of discretion,[27] as in this case. Since the Notice of Denial bore no indication as to the reason why Pacific Hub's application was denied, the CIR clearly contravened the requirements under Revenue Regulations No. 13-2001.[28] Similarly, the Warrant of Distraint and/or Levy was also void for being issued without a prior assessment, thereby contravening Pacific Hub's right to due process.[29]

Unyielding, the CIR sought reconsideration but was again brushed aside by the CTA En Banc through the oppugned Resolution.

Now, before this Court, the CIR resolutely asseverates that the CTA En Banc erred in holding that: (1) the CTA had jurisdiction to review the Notice of Denial; (2) the Notice of Denial was not issued in accordance with BIR regulations; and (3) the Warrant of Distraint and/or Levy was not validly issued.","This Petition for Review on Certiorari[1] seeks to overturn the Decision[2] and the Resolution[3] of the Court of Tax Appeals (CTA) sitting en banc which affirmed the nullity of the Warrant of Distraint and/or Levy[4] dated September 12, 2014 and the Notice of Denial[5] dated January 10, 2014 issued by petitioner Commissioner of Internal Revenue (CIR) against respondent Pacific Hub Corporation (Pacific Hub), and which denied the subsequent motion for reconsideration[6] filed by CIR, in CTA EB No. 1837.","The Petition is devoid of merit.

The first issue raised by CIR calls for a clarification on the extent of the ""other matters"" jurisdiction of the CTA and whether this can extend to reviewing the CIR's exercise of its power to grant or deny applications for abatement or cancellation of taxes, penalties, and interests. The CIR argues that it has sole discretion on this matter and the CTA's act of assuming jurisdiction over the case encroaches upon the prerogatives of the executive department in violation of the principle of separation of powers.[30]

This argument fails to persuade.

The CTA's ""other matters"" jurisdiction in relation to the CIR is enshrined in Section 7(a)(1) of Republic Act No. 1125,[31] as amended by Republic Act No. 9282:[32]
SEC. 7. Jurisdiction. — The CTA shall exercise:

(a) Exclusive appellate jurisdiction to review by appeal, as herein provided:

(1) Decisions of the Commissioner of Internal Revenue in cases involving disputed assessments, refunds of internal revenue taxes, fees or other charges, penalties in relation thereto, or other matters arising under the National Internal Revenue Code or other laws administered by the Bureau of Internal Revenue[.](Emphasis supplied)
In Commissioner of Internal Revenue v. Hambrecht & Quist Philippines, Inc.,[33] the Court had occasion to elucidate that the term ""other matters"" is virtually unbridled save for the qualifying phrase that immediately follows:
Plainly, the assailed CTA En Banc Decision was correct in declaring that there was nothing in the foregoing provision upon which petitioner's theory with regard to the parameters of the term ""other matters"" can be supported or even deduced. What is rather clearly apparent, however, is that the term ""other matters"" is limited only by the qualifying phrase that follows it.

Thus, on the strength of such observation, we have previously ruled that the appellate jurisdiction of the CTA is not limited to cases which involve decisions of the CIR on matters relating to assessments or refunds. The second part of the provision covers other cases that arise out of the National Internal Revenue Code (NIRC) or related laws administered by the Bureau of Internal Revenue (BIR).[34] (Emphasis supplied, citation omitted)
Indeed, a plain reading of the provision yields the inevitable conclusion that the CTA has the power to review not only matters arising or incidental to tax assessments or refunds, but also to any case arising from the application of the provisions of the Tax Code or other tax laws that are administered by the BIR. In fact, the Court has affirmed the CTA's ""other matters"" jurisdiction over cases involving: (a) the determination of whether the right of the CIR to collect the validly assessed tax has prescribed;[35] (b) cases seeking the cancellation and withdrawal of a warrant of distraint and/or levy;[36] (c) cases seeking a determination of the validity of waivers of the statute of limitations as well as the proper availment of tax amnesty;[37] and (d) cases on the proper exercise of the CIR's power to compromise delinquent accounts and to grant an informer's reward.[38]

From the foregoing, it becomes evident that the determination of whether the CIR has properly exercised the powers granted to it by the Tax Code may likewise fall under the CTA's ""other matters"" jurisdiction. However, does this also apply to the exercise of a power that is purely discretionary on the part of the CIR, such as the power to abate or cancel taxes, penalties, or interests?

The Court answers in the affirmative.

It bears accentuating that the Court had already impliedly recognized the CTA's jurisdiction to review the CIR's denial of an application for abatement in Qatar Airways Co. v. Commissioner of Internal Revenue,[39] albeit therein petitioner's case was ultimately dismissed for its failure to timely file its judicial petition before the CTA.

All the same, applicable laws and jurisprudence support the foregoing interpretation of the CTA's ""other matters"" jurisdiction.

The power to abate or cancel a tax liability is vested in the CIR under Section 204(B) of the Tax Code:
Section 204. Authority of the Commissioner to Compromise, Abate and Refund or Credit Taxes. – The Commissioner may –

. . . .

(B) Abate or cancel a tax liability, when:

(1) The tax or any portion thereof appears to be unjustly or excessively assessed; or

(2) The administration and collection costs involved do not justify the collection of the amount due.
The Court recognizes that this power to abate or cancel a tax liability is purely discretionary on the part of the CIR given that it is ""a power or right conferred upon them by law of acting officially, under certain circumstances, according to the dictates of their own judgments and consciences, uncontrolled by the judgments or consciences of others.""[40]

While the courts may generally not interfere in an administrative agency's exercise of a purely administrative or discretionary power, this rule admits of exceptions such as when ""the issuing authority has gone beyond its statutory authority, has exercised unconstitutional powers or has clearly acted arbitrarily and without regard to his duty or with grave abuse of discretion.""[41]

This flows from the reigning principle that the judicial power conferred by the 1987 Constitution on the Supreme Court and all other lower courts, including the CTA, necessarily carries with it the power to ""determine if any government branch or instrumentality has acted beyond the scope of its powers, such that there is grave abuse of discretion.""[42]

The Court has long settled that the CTA has the authority to issue writs of certiorari to review whether the acts or omissions of certain agencies are attended by grave abuse of discretion.[43] The Court has likewise declared that this authority is inherent in the exercise of its appellate jurisdiction.[44]

Invariably, it is this very same rationale which the Court applied in PNOC v. Court of Appeals[45] to hold that the exercise of the CIR's discretionary power to enter into a compromise is subject to the CTA's power of judicial review. The Court pronounced that the ""[CIR] would have to exercise his discretion within the parameters set by the law, and in case he abuses his discretion, the CTA may correct such abuse if the matter is appealed to them.""[46]

By parity of reasoning, the exercise of the CIR's discretionary power to abate or cancel taxes, penalties, and interests, if attended by grave abuse of discretion, is properly appealable to the CTA under its ""other matters"" jurisdiction, as was done in this case.

Having resolved that the CTA correctly assumed jurisdiction over the case at bench, the Court delves into the second issue on whether the Notice of Denial was indeed issued with grave abuse of discretion. Specifically, in denying Pacific Hub's application, did the CIR exercise its power in an arbitrary or despotic manner to the point that it amounted to an evasion of a positive duty or a refusal to act in contemplation of law?[47]

To this, the Court again answers in the affirmative.","ACCORDINGLY, the Petition for Review on Certiorari is DENIED. The November 8, 2019 Decision and the June 26, 2020 Resolution of the Court of Tax Appeals En Banc in CTA EB No. 1837 are AFFIRMED. The January 10, 2014 Notice of Denial and the September 12, 2014 Warrant of Distraint and/or Levy are DECLARED NULL and VOID."
