Case Number,Case Title,Facts,Decision,Ruling,Verdict
"G.R. No. 251518, November 27, 2024","DEL MONTE LAND TRANSPORT BUS COMPANY, DON L. MORALES, AND EILEEN FLORES, PETITIONERS, VS. ROMEO M. JARANILLA, MARLON H. GUANTERO, AND JESUS B. DOMANAIS, RESPONDENTS.","This case stemmed from consolidated complaints for illegal dismissal, full backwages, and reinstatement filed by respondents against petitioners. On November 25, 2013, LA Benedict G. Kato (LA Kato) issued a Decision granting the complaints and ruled that respondents were all illegally dismissed from their employment.[5]

DLTB, thereafter, interposed an appeal with the NLRC. On April 23, 2014, the NLRC issued a Decision[6] granting DLTB's appeal. The NLRC dismissed the consolidated complaints. In effect, the LA's Order dated November 25, 2013, was reversed and set aside.

Aggrieved, respondents moved for reconsideration. In its Resolution[7] dated October 31, 2014, the NLRC granted respondents' motion and reinstated the Decision of the LA.

Petitioners, thereafter, filed a Petition for Certiorari with the CA (CA-G.R. SP No. 138339) assailing the October 31, 2014 Resolution of the NLRC.[8] Pending resolution of CA-G.R. SP No. 138339, respondents moved for and secured a Writ of Execution[9] of the LA's November 25, 2013 Order. Pursuant to the said Writ, petitioners issued a check in the amount of PHP 1,189,364.42 as partial payment for the judgment award. Meanwhile, the balance of the judgment award shall be secured from the cash bond posted by petitioners in the amount of PHP 247,080.29.[10]

On March 27, 2015, LA Kato issued an Order[11] releasing to respondents the amounts that were due to them in satisfaction of the judgment award. Based on the Disbursement Vouchers, Jaranilla received the amount of PHP 397,541.02,[12] Guantero received the amount of PHP 387,895.25,[13]and Domanais, received the amount of PHP 403,928.14, all of which are exclusive of tax.[14]

Subsequently, on June 30, 2015, the CA, in CA-G.R. SP No. 138339 granted petitioners' Petition for Certiorari and annulled the October 31, 2014 Resolution of the NLRC.[15] The CA ratiocinated that respondents were legally dismissed from employment and that petitioners complied with the two-notice rule.[16] Essentially, the CA reinstated the April 23, 2014 NLRC Decision resulting in the dismissal of the complaints for supposed unlawful termination from employment by petitioners. On November 24, 2015, the Decision of the CA in CA-G.R. SP No. 138339 became final and executory.[17]

Thereafter, respondents filed before the LA a Motion for Issuance of Alias Writ of Execution.[18] Therein, respondents averred that the amount released to them corresponds to their accrued backwages or reinstatement wages computed only up to November 2014. They further claimed that considering that the NLRC, on motion for reconsideration, reinstated the LA's ruling, they are entitled to reinstatement wages from December 2014 up to the finality of the Decision of the CA reversing the LA's ruling. Accordingly, respondents asked for the issuance of an Alias Writ of Execution for the full satisfaction of their accrued backwages or reinstatement wages.[19]","For the Court's consideration is a Petition for Review on Certiorari[1] under Rule 45 of the Rules of Court filed by Del Monte Land Transport Bus Company (DLTB), Don L. Morales, and Eileen Flores (collectively, petitioners) assailing the Court of Appeals (CA) Decision[2] promulgated on March 14, 2019, in CA-G.R. SP No. 151070, which affirmed the National Labor Relations Commission (NLRC), Quezon City Resolution[3] dated January 30, 2017 in NLRC LAC No. 01-000227-14 (AE-10-16)(4), NLRC NCR CN 08-12004-13, NLRC NCR CN 08-12009-13, and NLRC NCR CN 08-12160-13. In its Resolution, the NLRC dismissed petitioners' appeal and affirmed the Labor Arbiter's (LA's) Order[4] dated August 30, 2016 in NLRC NCR Case No. 08-12004-13, issuing an Alias Writ of Execution in favor of Romeo M. Jaranilla (Jaranilla), Marlon H. Guantero (Guantero), and Jesus B. Domanais (Domanais), (collectively, respondents).","The instant petition is bereft of any merit.

In the instant petition, petitioners averred that the LA erred in granting the Motion for Issuance of Alias Writ of Execution considering that at the time of the filing thereof, respondents are no longer entitled to their accrued wages on account of the finality of the CA Decision in CA-G.R. SP No. 138339, which declared respondents as legally dismissed.[32]

Petitioners likewise averred that they are entitled to restitution. They explained that while they admit that the LA's November 25, 2013 Decision is immediately executory, hence, respondents have the right to reinstatement, either actual or in payroll, such right ceased to have any legal effect when the NLRC reversed the LA Decision on April 23, 2014 They also insisted that the reinstatement by the NLRC of the LA Decision on reconsideration is no longer immediately executory. Accordingly, respondents are not entitled to reinstatement from October 31, 2014, when the NLRC reinstated the November 25, 2013 Decision of the LA until the same was reversed by the CA on June 30, 2015.[33]

The Court is not persuaded.","ACCORDINGLY, in view of the foregoing premises, the Petition for Review on Certiorari is DENIED. The Court of Appeals Decision dated March 14, 2019, in CA-G.R. SP No. 151070 is AFFIRMED with MODIFICATION. The Labor Arbiter's Order dated August 30, 2016 is MODIFIED in that respondents Romeo M. Jaranilla, Marlon H. Guantero, and Jesus B. Domanais are entitled to reinstatement wages from November 25, 2013 to June 30, 2015. Let an Alias Writ of Execution be ISSUED to such effect.

The Labor Arbiter is further DIRECTED to make a re-computation of the amount of respondents' reinstatement wages for the said period and determine whether the amounts already released to respondents exceed or are less than the amounts that respondents are entitled to. Thereafter, the Labor Arbiter is DIRECTED to collect from petitioners the amount necessary for the full satisfaction of their reinstatement wages or return to petitioners any excess thereof."
