Case Number,Case Title,Facts,Decision,Ruling,Verdict
"G.R. No. 219686, November 27, 2024","GIL APOLINARIO, PETITIONER, VS. HEIRS OF FRANCISCO DE LOS SANTOS, REPRESENTED BY EDWIN DELOS SANTOS, RESPONDENTS.","On July 4, 1998 at around 7:30 a.m., Rico Villahermosa (Rico), the 16-year old son of Teresita Villahermosa (Teresita), was cutting down a banana plant on the side of Maharlika Highway upon the instruction and under the supervision of Apolinario, his school principal. The banana plant fell and hit Francisco De Los Santos (Francisco) who was driving his motorcycle along Maharlika Highway at the time.[5]

As a result, Francisco fell from his motorcycle and unto the cemented highway. He suffered from head injuries and passed away on July 8, 1998, with his death certificate indicating ""post-traumatic brain swelling"" and ""diffuse cerebral contusion"" as his cause of death.[6]

Aggrieved, the Heirs of Francisco filed a complaint for damages against Apolinario and Teresita. They averred that Apolinario was negligent when he instructed Rico to cut down the banana plant situated at the side of the highway without taking the necessary precautions to ensure the safety of passing motorists and pedestrians, and that Rico's and Apolinario's gross negligence was the proximate cause of the injuries and death of Francisco.[7]

The Heirs further averred that due to Francisco's accident and death, they incurred PHP 50,000.00 in hospital and medical expenses and PHP 47,000.00 as funeral expenses, and prayed for the payment of PHP 428,800 as compensation for the loss of expected income of the deceased as member of the Sangguniang Bayan of Sta. Margarita, Samar; PHP 50,000 for moral damages, PHP 20,000 for exemplary damages; PHP 20,000.00 for attorney's fees, and PHP 10,000.00 for the litigation expenses.[8] Anent Francisco's income, respondents alleged that he was earning monthly emoluments of PHP 12,620.00 and expected to receive the same continuously until end the of his term on June 1, 2001.[9]

Elias Udjay (Elias) testified that his son Arnel also attended Barangay Palale Elementary School, and that he was only two arms' length away from Apolinario and Rico at the time of the incident.[10] A teacher called for pintakasi, an event supervised by Apolinario as the head of the teachers.[11] Elias was cutting grass along the school vicinity when he witnessed Apolinario instructing Rico to cut a banana plant just outside the fence of the school and across the highway opposite the school. While Rico was cutting down the plant, it hit Francisco.[12]

Edwin de los Santos (Edwin), the son of the deceased Francisco, testified that at the time of his father's death, Francisco was a member of the Sangguniang Bayan of Sta. Margarita.[13] He also brought with him his father's death certificate.[14]

Rico, who was not impleaded as a defendant but appeared in court as a witness, testified that he was 15 years old at the time of the incident.[15] The day prior to pintakasi, Apolinario conducted a meeting for the activity which his mother attended.[16] His mother told him that the attendees were advised that adult students may join the pintakasi and their parents need not go to school; hence, Rico attended the activity since he was old enough.[17] Rico likewise testified that during the activity, Apolinario instructed him to cut down the banana plant.[18] He crossed the road directly across the school and started cutting the banana plant, and he only saw Francisco when the banana plant was about to fall down.[19] After Francisco was hit at the back of his neck, Apolinario was at the side of the road and did not help Francisco. Afterwards, the police brought Francisco to the hospital. Thereafter, the pintakasi continued and Apolinario still issued orders to the participants.[20]

Teresita prayed for the dismissal of the complaint against her. She averred that her minor son cut down the banana plant on instruction of Apolinario and under his supervision as school principal.[21]

In his defense, Apolinario asserted that: (a) he could not have been supervising and instructing Rico on how to cut the banana plant since he was not present when the incident happened; (b) at the time of the incident, he was 10 meters away supervising the construction of a fence, while Rico was in the actual supervision of two teachers; (c) the incident did not take place on a school day; it was a Saturday, during an activity by parents, teachers, and the adult community of Brgy. Palale, Sta. Margarita, Samar; (d) his co-defendant Teresita should be the one held liable, as she sent Rico to the event without informing the school, parents, teachers, and adult community organization of such fact; (e) assuming that Rico was under the school's control and supervision during the activity, the responsibility attaches only to the teacher-in-charge. Apolinario also filed a counterclaim for the award of moral damages.[22]

For his part, Apolinario testified that he was the principal of Brgy. Palale Elementary School, Sta. Margarita, Samar at the time of the incident, which was a public elementary school and not a school of trade and industry.[23] He did not handle any classes, and the principal's office was not involved in the pintakasi as he did not attend any meeting with regard to the parent-teacher association. The teachers were the ones in charge of supervising the activities. A day before the activity, the teachers informed him that the pintakasi would be held, which involved the teachers and parents of their pupils.[24]

Apolinario asserted that when the late Francisco was hit by the felled banana plant at around 7:30 a.m., he was on his way to the central school. After he entered his office, a parent informed him that a boy was cutting a banana plant, and the trunk of the banana plant fell on Francisco along the highway, causing him to slip. He inspected the place of the incident.[25]","This resolves the Petition for Review on Certiorari[1] assailing the Decision[2] and the Resolution[3] of the Court of Appeals (CA), which modified the Regional Trial Court's Decision[4] that granted the Heirs of Francisco De Los Santos' (Heirs) complaint for damages against Gil Apolinario (Apolinario).","The petition is partly granted.

Apolinario, as the teacher-in-charge of Rico at the time of the commission of the latter's tortious act, is vicariously liable for damages


Preliminarily, the trial court's finding of negligence, when affirmed by the CA, is a question of fact that the Court cannot pass upon without going into factual matters touching on the finding of negligence. In petitions for review on certiorari under Rule 45 of the Revised Rules of Court, this Court is limited to reviewing only errors of law, not of fact, unless the factual findings complained of are devoid of support by the evidence on record, or the assailed judgment is based on a misapprehension of facts.[38]

Here, the RTC and the CA uniformly held that Apolinario was negligent in directing Rico to cut the plant without observing the degree of care required under the circumstances to prevent the incident leading to Francisco's death, and thus liable for damages. We find no reason to disturb the findings of the RTC and CA. However, considering Apolinario's assertion that it is Teresita and not him who should be held liable for damages for Rico's act, a discussion on the nature and basis of his liability and Teresita's is in order.

A teacher-in-charge's civil liability for quasi-delicts committed by pupils in their custody is anchored in Articles 2176 and 2180 of the Civil Code:
ART. 2176. Whoever by act or omission causes damage to another, there being fault or negligence, is obliged to pay for the damage done. Such fault or negligence, if there is no pre-existing contractual relation between the parties, is called a quasi-delict and is governed by the provisions of this Chapter. (1902a)

ART. 2180. The obligation imposed by article 2176 is demandable not only for one's own acts or omissions, but also for those of persons for whom one is responsible.

. . . .

Lastly, teachers or heads of establishments of arts and trades shall be liable for damages caused by their pupils and students or apprentices, so long as they remain in their custody.","ACCORDINGLY, the Petition for Review on Certiorari is PARTLY GRANTED. The May 28, 2014 Decision and the June 24, 2015 Resolution of the Court of Appeals in CA G.R. CV No. 03433 are AFFIRMED with MODIFICATION.

Petitioner Gil Apolinario is ordered to pay respondent heirs of Francisco de los Santos the following: (a) PHP 250,000.00 as temperate damages; (b) PHP 50,000.00 as civil indemnity; (c) PHP 50,000.00 as moral damages; and (d) PHP 5,000.00 as litigation expenses. Interest at the rate of six percent per annum shall be imposed on all damages awarded from the finality of this Decision until fully paid."
"G.R. No. 271934, November 27, 2024","HEIRS OF AQUILINO RAMOS, REPRESENTED BY WILBUR M. RAMOS, MARILOU G. ILAGAN, LYDIA GALARRITA, BENJAMIN GALARRITA, THE MUNICIPAL ASSESSOR OF ALUBIJID, MISAMIS ORIENTAL, AND PROVINCIAL ASSESSOR OF MISAMIS ORIENTAL, PETITIONERS, VS. PROSALITA BAGARES AND DANTON BAGARES, REPRESENTED BY PROSERFINA GALARRITA, RESPONDENTS.","Respondents alleged that on July 24, 1995, they purchased a 3,000-square meter parcel of land owned by the late Basilia Galarrita-Naguita (Basilia), situated in Lanao, Alubijid, Misamis Oriental, and identified as Lot No. 12020. Said property is a portion of the 7,687-square meter landholdings of Basilia. Basilia also sold a portion of Lot No. 12020, consisting of 3,655 square meter to the Local Government of Alubijid, Misamis Oriental and the remaining portion, consisting of 1,032 square meter to Prosalita.[4]

Subsequently, Aquilino Ramos (Aquilino) filed before the Department of Environment and Natural Resources (DENR) a free patent over Lot No. 12020 consisting of 7,687 square meter. Respondents opposed the application and alleged that Aquilino deliberately tampered the Deed of Sale of Unregistered Land he submitted to the Provincial Environment and Natural Resources Office (PENRO) by changing Lot No. 12019 to Lot No. 12020. PENRO denied the free patent filed by Aquilino.[5]

Meanwhile, Marilou, Benjamin, Elyer, and Lydia were buyers of a portion of Lot No. 12020 from Aquilino. The case became the subject of barangay conciliation, but the parties failed to reach an amicable settlement of their dispute.[6] They averred that the portion of land claimed by respondents is not the same portion they owned and possessed since 1978.[7]

On June 14, 2004, petitioners argued that their predecessor-in-interest did not tamper with the Deed. Further, they maintained that after Aquilino bought the subject property, he and the rest of them lived in the subject property until he sold some portions of it.[8]","Before the Court are consolidated Petitions for Review on Certiorari[1] assailing the Decision[2] dated May 31, 2023, of the Court of Appeals (CA) in CA-G.R. CV No. 06149-MIN filed by the following: (1) the Heirs of Aquilino Ramos, represented by Wilbur M. Ramos (Wilbur), Marilou G. Ilagan (Marilou), Lydia Galarrita (Lydia), and Benjamin Galarrita (Benjamin); and (2) Marilou, Benjamin, and Elyer Galarrita (Elyer) (collectively, petitioners).

The CA affirmed the Decision[3] dated March 19, 2019, of Branch 44, Regional Trial Court (RTC), Initao, Misamis Oriental in Civil Case No. 2004-487 which granted the complaint for Declaration of Nullity of Tampered Deed of Sale of Unregistered Land filed by Prosalita Galarrita Bagares (Prosalita) and Danton Bagares (Danton), represented by Proserfina Galarrita (Proserfina) (collectively, respondents).","It is settled that a Rule 45 petition should only raise questions of law as the Court is not a trier of fact.[20] ""A question of law arises when there is doubt as to what the law is on a certain state of facts, while there is a question of fact when the doubt arises as to the truth or falsity of the alleged facts.""[21]

In the case, the following issues raised are factual matters that are beyond the scope of an appeal by certiorari under Rule 45 of the Rules of Court: (1) whether the deed of sale of Lot No. 12020 is null and void for having been tampered with; (2) whether prescription has already set in in favor of petitioners; and (3) whether petitioners are buyers in good faith.

In any case, even if the consolidated petitions are given due course, they must still fail for petitioners' failure to prove that the CA erred in affirming the ruling of the RTC in favor of respondents. As aptly observed by the CA:
In the present case, the findings of the DENR that Aquilino Ramos deliberately tampered his free patent application for Lot No. 12020 carries great weight and should be accorded respect, more so, when Aquilino Ramos failed to rebut such findings. There being no controversion, the presumption of regularity in the performance of official duties applies favorably to the DENR. This means that the DENR's findings has become conclusive...

Aside from the findings of the DENR, the Court notes that Aquilino Ramos admitted during the barangay proceedings that he tampered [with] the deed of sale attached in his free patent application to Lot No. 12020. The admission by Aquilino Ramos qualifies as a judicial admission. Since such statement is judicial admission, it does not require proof according to Section 4, Rule 129 of the Rules of Court, which provides:
SEC. 4. Judicial admissions. – An admission, verbal or written, made by a party in the course of the proceedings in the same case, does not require proof. The admission may be contradicted only by showing that it was made through palpable mistake or that no such admission was made.
Since there is judicial admission that the deed of sale was tampered [with], then there is no question that the Deed of Sale of Unregistered Land selling Lot 12020 is void. Consequently, the Deed of Sale of Unregistered Land selling Lot 12020 did not transfer ownership of the land to appellants, as Aquilino Ramos had no title or interest to transfer.[22] (Citations omitted)
Indeed, ""the trial court's findings of fact are entitled to great weight and will not be disturbed on appeal.""[23] ""The rule finds an even more stringent application where the findings are sustained by the CA.""[24]

Here, the Court finds no cogent reason to overturn the finding of the RTC, as affirmed by the CA, that the subject Deed of Sale is void for having been tampered with by Aquilino Ramos.

Moreover, there is no merit in the argument of the Heirs of Aquilino Ramos in G.R. No. 271934 that they acquired ownership of the subject property by prescription.

""Prescription is a mode of acquiring ownership through the lapse of time and under certain conditions.""[25] It may either be ordinary or extraordinary.[26] ""Ordinary acquisitive prescription requires possession of things in good faith and with just title for a period of ten years, while extraordinary acquisitive prescription requires uninterrupted adverse possession of thirty years, without need of title or of good faith.""[27] As correctly observed by the CA:
In the case at bar, ordinary acquisitive prescription is unavailing as it demands that the possession be ""in good faith and with just title,"" and there is no evidence on record to prove [the Heirs of Aquilino Ramos'] ""good faith.""

Likewise, [the Heirs of Aquilino Ramos'] adverse possession of the land fell short of the requirements for extraordinary acquisitive prescription to set in. The records show that the subject land is an unregistered land. When the [Heirs of Aquilino Ramos] filed the instant case on April 15, 2004, [they] were in possession of the land for only 26 years counted from the time of the alleged start of their possession in 1978. Obviously, it fell short of the required 30 years of uninterrupted adverse possession without just title and good faith.[28] (Citations omitted)
The Court likewise rejects the contention of Marilou, Benjamin, and Elyer in G.R. No. 272834 that they are buyers in good faith because they had no notice that the seller did not have the capacity to sell the subject property. The records show that Marilou, Benjamin, Elyer, and Lydia bought the property when it was still an unregistered land. Jurisprudence dictates that ""[t]he defense of having purchased the property in good faith may be availed of only where registered land is involved and the buyer had relied in good faith on the clear title of the registered owner.""[29]

Finally, the Court notes the following infirmities in the petition which further warrant the consolidated petitions' denial:

In G.R. No. 271934, the Petition lacks: (a) a statement of material date of receipt of the assailed CA Decision; and (b) the proof of service thereof to the adverse parties and the CA.

In G.R. No. 272834, the timeliness of the motion for extension to file a petition for review on certiorari could not be determined due to an illegible postal mark. The Petition also lacks: (a) the proof of service thereof to the adverse parties and the CA; (b) a verified declaration of electronic submission of the filed soft copy of the petition as required under the Rules on E-Filing (A.M. No. 10-3-7-SC and the Efficient Use of Paper Rule (A.M. No. 11-9-4-SC); and (c) a statement of material date of filing of the motion for reconsideration of the assailed CA Decision.

Moreover, the jurat of the verification and certification of non-forum shopping lacks affiant's current identification document issued by an official agency bearing the photograph and signature of the individual in violation of Rule II, Sections 2, 6, and 12 of the 2004 Rules of Notarial Practice, as amended by A.M. No. 02-8-13-SC dated February 19, 2008. The verification and certification of non-forum shopping, too, was signed by Benjamin without proof of authority to sign for and on behalf of Marilou and Elyer.

All told, the Court resolves to deny the instant petitions for: first, raising factual issues; second, being procedurally defective; and third, failure of petitioners to show that the CA committed any reversible error as to warrant the Court's exercise of its discretionary appellate jurisdiction.

However, the Court finds it proper to delete the award of attorney's fees, in line with prevailing jurisprudence.","ACCORDINGLY, the consolidated petitions are DENIED. The Decision dated May 31, 2023, of the Court of Appeals in CA-G.R. CV No. 06149-MIN is AFFIRMED with MODIFICATION, in that the award of attorney's fees is DELETED."
