Case Number,Case Title,Facts,Decision,Ruling,Verdict
"G.R. No. 261323, November 27, 2024","CAPTAIN RAMON R. VERGA, JR., PETITIONER, VS. HARBOR STAR SHIPPING SERVICES, INC., RESPONDENT.","Harbor Star is a domestic corporation duly incorporated in accordance with the laws of the Republic of the Philippines.[6] It is primarily engaged in the business of providing harbor assistance, towing services, salvage, repairs, dry dock, and other related services to foreign and domestic sea-going vessels.[7]

On the other hand, Verga was a shareholder of Davao Tugboat and Allied Services, Inc. (DATASI) and Davtug Multi-Purpose Cooperative (DAVTUG) which are both engaged in businesses similar to Harbor Star's.[8] Particularly, DATASI was a domestic corporation involved in the tug and towage business in the district port of Davao.[9] It was managed by Verga and two other pilots, Captain Vicente Lagura (Lagura) and Captain Edgardo Alaan (Alaan).[10] In the course of its business, DATASI's principal shareholders organized a cooperative, DAVTUG, on March 7, 2006 to acquire more tugboats under the benefit of Republic Act No. 9520,[11] or the Philippine Cooperative Code of 2008. According to Verga, DATASI has been dominating the tugboat business in Davao as early as 2006.[12]

On several occasions between November 2006 to May 2008, Harbor Star wrote to DATASI, requesting business meetings for the parties to collaborate and work synergistically despite being competitors in the tugboat and towage business.[13] Notably, Harbor Star proposed several schemes through which it and DATASI may jointly conduct tugboat operations in Davao, including, among others, merger, partnership, and a joint venture with assignment of area operations.[14]

Harbor Star alleged that sometime during the second semester of 2008, it eventually persuaded Verga, as well as Lagura and Alaan, to sell their shares of stock in DATASI, with the understanding that after the final audit of the books of the two entities, and after receipt of more than 50% of the agreed valuation of the shares, they will comply with their obligation to execute the pertinent documents for the transfer of their shares of stock in DATASI to Harbor Star.[15] Supposedly, the parties agreed in principle to the PHP 6,000,000.00 valuation of Verga's shares, which shall be adjusted depending on the outcome of the final audit.[16] Although a Memorandum of Agreement[17] was prepared by Harbor Star in connection with the transaction, the draft was not executed by the parties and their agreement was not reduced in writing.[18]

Thereafter, from September 2008 to July 2009, Harbor Star made several installment payments to Verga, for a total amount of PHP 4,000,000.00.[19]

Later, in 2012, Harbor Star found out that after its initial payment to Verga, the latter divested his shares in DATASI, thereby making it impossible for him to transfer his DATASI shares to Harbor Star.[20] In a Letter[21] dated February 21, 2012, Harbor Star demanded Verga to return the sums of money that he received as payment for his shares in DATASI. Instead of returning the money, Verga demanded an additional amount of PHP 2,000,000.00 from Harbor Star for the latter to purportedly complete the payment of the PHP 6,000,000.00 due under their agreement.[22]

Thus, on April 12, 2012, Harbor Star filed a Complaint against Verga, praying that he be ordered to return the PHP 4,000,000.00 that he received from Harbor Star.[23] It averred that: one, it orally entered into an agreement for the sale of Verga's shares in DATASI and DAVTUG; and two, by divesting his interests in DATASI, Verga made it impossible for him to comply with his obligation to transfer his DATASI shares to Harbor Star. Thus, Harbor Star argued that Verga should return the sums of money that he received for the said shares.

In his defense, Verga denied the purported oral contract of sale over his DATASI and DAVTUG shares to Harbor Star. He narrated that there were several negotiations for Harbor Star to buyout the shares of the members of DAVTUG. However, Harbor Star spread a rumor among the cooperative members that Verga, Lagura, and Alaan will receive commissions from the buyouts, resulting in dissension among the members. Harbor Star then took advantage of the situation and tricked Verga, Lagura, and Alaan to resign from DAVTUG and DATASI in exchange for PHP 6,000,000.00. Supposedly, their resignation will serve as a marketing tool for Harbor Star to entice ship owners and agents to avail themselves of Harbor Star's services instead of DATASI's and DAVTUG's.[24]

Verga further alleged that in pursuit of their agreement, he resigned from DAVTUG on July 11, 2009, after he received a total of PHP 4,000,000.00 from Harbor Star.[25] However, Harbor Star reneged on its obligation by refusing to pay the remaining PHP 2,000,000.00 balance of the resignation incentive. He thus filed his counterclaim against Harbor Star in the amount of PHP 2,000,000.00, representing the unpaid balance of the resignation incentive.

Finally, Verga argued that Harbor Star could not have validly entered into an oral contract for the acquisition of his DATASI and DAVTUG shares in the absence of the approval of a majority of the board of directors (Board) of Harbor Star and ratification by the shareholders representing at least 2/3 of the outstanding capital stock of the corporation, in accordance with Section 42[26] of Batas Pambansa Blg. 68,[27] or the Corporation Code.[28] He insisted that the alleged agreement with Harbor Star for the sale of his DATASI and DAVTUG shares was unenforceable under the Statute of Frauds,[29] as provided in Article 1403(2)(d)[30] of the Civil Code.","Before the Court is a Petition for Review on Certiorari[1] (Petition) under Rule 45 of the Rules of Court assailing the Decision[2] dated October 28, 2021, and the Resolution[3] dated June 6, 2022, of the Court of Appeals (CA) in CA-G.R. CV No. 109255. The CA denied the appeal of petitioner Captain Ramon R. Verga, Jr. (Verga) and affirmed with modification the Decision[4] dated November 17, 2016, of Branch 66, Regional Trial Court (RTC), Makati City in Civil Case No. 12-298 that granted the Complaint for Sum of Money and Damages (Complaint) filed by respondent Harbor Star Shipping Services, Inc. (Harbor Star) against Verga.

In its Resolution, the CA denied the Motion for Reconsideration[5] of Verga for lack of merit.","The Petition is denied for lack of merit.

The Petition raises factual issues that are beyond the scope of a Rule 45 proceeding.[66] It is not the function of the Court to analyze or weigh all over again the evidence already considered and ruled upon by the RTC and the CA.[67] While there are recognized exceptions[68] to the rule, Verga has not shown that any of the exceptions apply to the present case.

At any rate, the Court finds no reversible error in the challenged rulings of the CA.
 
I.
The records establish that the parties entered into a contract of sale over Vergas DATASI shares to Harbor Star
 

The CA determined that there is a preponderance of evidence showing that the parties entered into an oral contract to sell Verga's shares in DATASI and DAVTUG, and that Harbor Star made partial payments for the shares in the total amount of PHP 4,000,000.00. Given that Verga divested his interest in DATASI, the CA held that Verga made it legally impossible for him to transfer and deliver the DATASI shares to Harbor Star, thereby making him liable to return the money that he received from Harbor Star.[69]

Verga imputes error to the CA's conclusion upon the argument that he received PHP 4,000,000.00 from Harbor Star as incentive for him to resign from DATASI and DAVTUG and not as partial payment for his shareholdings.[70]

The Court partially agrees with the CA that based on the evidence on record, the parties entered into a contract for the buyout of Verga's shares. However, the Court finds that the agreement is an oral contract of sale, not a contract to sell. Further, the subject matter of the agreement pertained only to Verga's shares in DATASI and not in DAVTUG, given that the vouchers[71] evidencing Harbor Star's payment of PHP 4,000,000.00 to Verga referred only to the DATASI shares. The draft memorandum of agreement[72] attached to the record also indicates a sale of Verga's DATASI shares to Harbor Star.

Although the CA's finding as regards the nature of the contract between the parties as an oral contract to sell and not a contract of sale was unassigned, the Court finds it proper to review the same in determining the appropriate remedies available to Harbor Star.
 
A.
The sum of money that Harbor Star paid to Verga was for the latter's shareholdings in DATASI
 

Article 1371 of the Civil Code states that ""[i]n order to judge the intention of the contracting parties, their contemporaneous and subsequent acts shall be principally considered."" Otherwise said, the decisive factor in determining the nature of a contract is the intention of the parties, as shown by their conduct, words, actions and deeds prior to, during, and immediately after the execution of the agreement.[73] As explained by the Court in Javier v. Court of Appeals:[74]
It is settled that the previous and simultaneous and subsequent acts of the parties are properly cognizable indicia of their true intention. Where the parties to a contract have given it a practical construction by their conduct as by acts in partial performance, such construction may be considered by the court in construing the contract, determining its meaning and ascertaining the mutual intention of the parties at the time of contracting. The parties' practical construction of their contract has been characterized as a clue or index to, or as evidence of, their intention or meaning and as an important, significant, convincing, persuasive, or influential factor in determining the proper construction of the agreement.[75]
The previous, contemporaneous, and subsequent acts of the parties demonstrate that they entered into a contract of sale, wherein Verga, as seller, sold his DATASI shares to Harbor Star, as buyer, in exchange for a sum of money. The parties' conduct does not support Verga's contention that Harbor Star paid him PHP 4,000,000.00 only as an incentive for him to resign from DATASI and DAVTUG.

First, Verga testified that before he received a total of PHP 4,000,000.00 from Harbor Star supposedly as incentive for his resignation from DATASI and DAVTUG, Harbor Star presented to him a draft memorandum of agreement[76] to reflect its intention.[77] However, a reading of the draft memorandum reveals that it pertains to the sale of Verga's DATASI shares to Harbor Star, not to an agreement for Verga to resign from DAVTUG in exchange for a sum of money:
The First Party [Harbor Star] acknowledges that the Second Party [Verga] is a stockholder of the present exclusive provider of pilotage services in Davao City. The Second Party [Verga] undertakes to protect the interests of the First Party [Harbor Star] to enable it to recover its investments in the tugboats.

2. CONSIDERATION – In consideration for this Agreement, the Second Party [Verga] hereby sells all his interests in the tug company (DATASI) in the amount of PESOS: SIX MILLION (Php6,000,000), ONE MILLION PESOS (Php1,000,000) of which is hereby acknowledged by the Second Party as having been received by him as Advance Payment.[78] (Italics supplied)
Although the draft memorandum of agreement was not signed by the parties, it still provides an insight into the intent behind Harbor Star's payment of PHP 4,000,000.00 to Verga. Verily, the Court has considered prior drafts of an agreement to discover the intent of the contracting parties and the circumstances surrounding their contract.[79]

Second, as correctly pointed out by the lower courts, several of the payment vouchers issued by Harbor Star indicate that the sums of money that it remitted to Verga referred to payments for his DATASI shares.[80] The Court particularly notes that one of the voucher receipts signed by Verga states that that he received PHP 250,000.00 from Harbor Star as ""Partial Payment for DATASI Shares[.]""[81]

Notably, the Memorandum of Agreement and payment vouchers indicate that the subject of the agreement between the parties pertained only to Verga's shareholdings in DATASI and not in DAVTUG. Hence, in contrast to the lower courts' conclusions, the Court finds that the PHP 4,000,000.00 that Harbor Star paid to Verga was only for the latter's shares in DATASI, not DAVTUG.

Despite the payment vouchers, Verga denies receiving the money as payment for his DATASI shares because, allegedly, when he signed the receipt, it was blank and did not indicate the purpose for the payment. He avers that the phrase ""Partial Payment for DATASI Shares"" was merely intercalated.[82]

The Court cannot lend credence to Verga's insistence that the vouchers were intercalated because of the elementary principle that forgery or falsification is never presumed and must be proven by clear, positive, and convincing evidence.[83] Significantly, neither the RTC nor the CA made any finding of forgery as to the vouchers. Besides, as pointed out by the RTC, Verga's allegation lacks credibility because the voucher[84] itself states that the amount of PHP 250,000.00 was being remitted to him as partial payment for his DATASI shares, yet he did not refute the contents of the voucher.[85]

Third, prior to the oral contract of sale, the letters exchanged between Harbor Star and DATASI representatives reveal the former's intention to enter into a merger or partnership with DATASI.[86] The acquisition of Verga's shares in DATASI is more consistent with Harbor Star's previous offers of merger or partnership.

Finally, as pointed out by Harbor Star, Verga's resignation from DAVTUG does not appear to have been prompted by the PHP 4,000,000.00 that he received from Harbor Star. Based on the Letter[87] dated July 11, 2009, that Verga signed, he resigned from DAVTUG after the other members refused to buyout his shares in the cooperative:
Last July 5, 2009 we offered to sell our shares to the cooperative or its members with a request that we be informed by July 10, 2009. We have not been favored with a reply. We view this as a refusal to buy our shares as determined by the auditor.

We are therefore tendering our resignation as members of our cooperative effective on July 11, 2009.[88]
The foregoing circumstances reveal the intention of the parties to enter into a contract for Harbor Star to acquire Verga's shareholdings in DATASI. The CA was therefore correct in holding that Verga received PHP 4,000,000.00 from Harbor Star as payment for his shareholdings in DATASI.","WHEREFORE, the Petition for Review on Certiorari is DENIED for lack of merit. The Decision dated October 28, 2021, and the Resolution dated June 6, 2022, of the Court of Appeals in CA-G.R. CV No. 109255 are hereby AFFIRMED with MODIFICATION, in that petitioner Captain Ramon R. Verga, Jr. is ORDERED to:
1)
RETURN to Harbor Star Shipping Services, Inc. the amount of PHP 4,000,000.00;


2)
PAY compensatory interest due on the PHP 4,000,000.00 at the rate of 6% per annum from the date of extrajudicial demand on March 22, 2012, until full payment; and


3)
PAY attorney's fees in the amount of PHP 100,000.00 to Harbor Star Shipping Services, Inc.
All amounts awarded shall likewise earn legal interest at the rate of 6% per annum from the date of its finality of this Decision until full payment."
